{
  "ir_version": "0.2.1",
  "id": "study_bar_on_live_test",
  "name": "真机测试：开书房显示器挂灯",
  "version": 1,
  "mode": "single",
  "meta": {"note": "接手真机实测：真实下发 light.turn_on 到书房显示器挂灯"},
  "nodes": [
    {
      "id": "a1",
      "kind": "on",
      "name": "书桌前有人（回放触发）",
      "trigger": { "type": "state", "entity_id": "binary_sensor.study_desk_motion", "to": "on" }
    },
    {
      "id": "d1",
      "kind": "do",
      "name": "开书房显示器挂灯",
      "adapter": "ha",
      "action": "light.turn_on",
      "params": { "entity_id": "light.yeelink_cn_555003624_lamp22_s_2" },
      "result_var": "bar_on"
    },
    { "id": "p1", "kind": "pass", "name": "结束" }
  ],
  "edges": [
    { "from": "a1", "to": "d1", "kind": "then" },
    { "from": "d1", "to": "p1", "kind": "then" },
    { "from": "d1", "to": "p1", "kind": "on_error" }
  ]
}
